{
  "id": "09-think-cognitive-model",
  "order": 9,
  "module": "adaptive_thinking",
  "title": {"en": "Thoughts sit between events and feelings"},
  "checkpoints": [
    {"id": "ritual-check", "type": "ritual", "title": {"en": "Weekly check-in"},
     "content": {"en": ["Fill in the symptom check."]},
     "formRef": "form:symptom-checklist"},
    {"id": "ritual-meds", "type": "ritual", "title": {"en": "Medication check"},
     "content": {"en": ["Record prescribed and missed doses."]},
     "formRef": "form:medication-adherence"},
    {"id": "read-model", "type": "reading", "title": {"en": "The cognitive model"},
     "content": {"en": [
       "Between a situation and how you feel sits a thought. Two people in the same moment can feel differently because their thoughts differ.",
       "In ADHD, years of struggle build a failure narrative: tasks feel bigger than they are, because the old story says you won't manage.",
       "The skill is noticing the thought before you act on it. You can't always stop the thought, but you can pause long enough to see it."
     ]}},
    {"id": "ex-label", "type": "exercise", "title": {"en": "Re-read your Week-1 map"},
     "content": {"en": ["Open the situations you mapped in session 1. For each, name the automatic thought that showed up."]}},
    {"id": "hw-read", "type": "homework", "title": {"en": "Home practice"},
     "content": {"en": ["Catch and write down three automatic thoughts during the week as they happen."]}},
    {"id": "ref-obstacles", "type": "reflection", "title": {"en": "Anticipate the week"},
     "content": {"en": ["What is likely to get in the way this week, and what will you do when it happens?"]}}
  ]
}
